"slug","book","chapter","title","subject","recommendation","execution_metric","schedule","result_metric"
1,"דו”ח ועדת טרכטנברג","חינוך","צעדים בגילאי 0-3","העברת הסמכות והאחריות על תחום החינוך לגיל הרך למשרד החינוך","העברת הסמכות והאחריות על תחום מעונות היום והמשפחתונים לגיל הרך ממשרד התמ""ת למשרד החינוך","החלטת ממשלה","השלמת ההעברה ספטמבר 2012",
2,"דו”ח ועדת טרכטנברג","חינוך","צעדים בגילאי 0-3","החלת תקינה ופיקוח על מעונות עם 7 ילדים ומעלה","אישור הצעת חוק הפיקוח, הנמצאת בהכנה לקריאה שנייה ושלישית בכנסת.","אישור הצעת החוק.","דצמבר 2011 השלמת יישום - דצמבר 2016","תחילת יישום חוק הפיקוח החל מספטמבר 2012"
3,"דו”ח ועדת טרכטנברג","חינוך","צעדים בגילאי 0-3","הרחבת היצע מעונות היום המפוקחים ומסובסדים","בינוי מעונות יום חדשים","גיבוש נוהל לסיוע בבינוי מעונות יום והפעלתו","הגדלת מספר הילדים השוהים במעונות יום מסובסדים מדי ספט'","בינוי מעונות יום חדשים לכ-30 אלף ילדים חדשים בתוך 5 שנים"
4,"דו”ח ועדת טרכטנברג","חינוך","צעדים בגילאי 0-3","הרחבת היצע מעונות היום המפוקחים ומסובסדים","סיוע במימון של התאמות לתקינה, שתידרש לפי חוק הפיקוח, למעונות שיתחייבו לקבל על עצמם את צו הפיקוח על המחיר","גיבוש נוהל לסיוע במימון והפעלתו","סיום עד דצמבר 2016","כניסה של כ- 30,000 מקומות במעונות היום הפרטיים למערך הפיקוח על המחיר"
5,"דו”ח ועדת טרכטנברג","חינוך","צעדים בגילאי 0-3","החלת תקינה ופיקוח אחידים","הפעלת מערך פיקוח אפקטיבי",,"פעילות מדי שנה","פיקוח אפקטיבי על כלל המסגרות החינוכית"
6,"דו”ח ועדת טרכטנברג","חינוך","צעדים בגילאי 0-3","תגבור הדרכת מטפלות וההכשרות המקצועיות","תגבור מערך ההכשרות הקיים","תקצוב",01/01/12,
